{"schema_version":"adapter-capability-negotiation-compact.v0","app_version":"adapter-capability-negotiation.v0","capability_contract_version":"agentmesh-adapter-capabilities.v0","valid":true,"status":"unsupported","common_fields_supported":[],"common_fields_unsupported":["status"],"adapter_capabilities_supported":[],"adapter_capabilities_unsupported":["comments"],"normalized_errors":[]}
