{"schema_version":"adapter-capability-negotiation-compact.v0","app_version":"adapter-capability-negotiation.v0","capability_contract_version":"agentmesh-adapter-capabilities.v0","valid":true,"status":"supported","common_fields_supported":["status","title"],"common_fields_unsupported":[],"adapter_capabilities_supported":["labels"],"adapter_capabilities_unsupported":[],"normalized_errors":[]}
