{"schema_version":"adapter-capability-negotiation-compact.v0","app_version":"adapter-capability-negotiation.v0","capability_contract_version":"agentmesh-adapter-capabilities.v0","valid":true,"status":"partially_supported","common_fields_supported":["title"],"common_fields_unsupported":["status"],"adapter_capabilities_supported":["labels"],"adapter_capabilities_unsupported":["comments"],"normalized_errors":[]}
